{
  "intent": "chunk",
  "canonicalUrl": "https://example.com/articles/renewable-energy-guide",
  "language": "en",
  "contentType": "article",
  "mediaType": "text/html",
  "query": "how solar panels convert sunlight to electricity",
  "mode": "hybrid",
  "scoringId": "bm25_e5_hybrid_v2",
  "chunks": [
    {
      "rank": 1,
      "score": 0.94,
      "span": {
        "start": 1245,
        "end": 1456,
        "unit": "char"
      },
      "quote": "Photovoltaic cells capture photons from sunlight and convert them into electrical energy through the photovoltaic effect. When sunlight strikes the cell, electrons are knocked loose from atoms in the semiconductor material.",
      "section": "How Solar Panels Work"
    },
    {
      "rank": 2,
      "score": 0.87,
      "span": {
        "start": 2103,
        "end": 2289,
        "unit": "char"
      },
      "quote": "The direct current (DC) generated by solar panels must be converted to alternating current (AC) by an inverter before it can be used in homes and businesses.",
      "section": "Power Conversion and Grid Integration"
    },
    {
      "rank": 3,
      "score": 0.81,
      "span": {
        "start": 3456,
        "end": 3598,
        "unit": "char"
      },
      "quote": "Modern solar panels typically achieve 15-22% efficiency in converting sunlight to electricity, with premium panels reaching up to 24%.",
      "section": "Efficiency and Performance"
    }
  ],
  "provenance": {
    "contentHash": "sha256:abc123def456789012345678901234567890123456789012345678901234567890",
    "generatedAt": "2024-01-15T10:30:45Z"
  },
  "length": {
    "inputTokens": 1547,
    "outputTokens": 142,
    "totalTokens": 1689,
    "truncated": false
  }
}
